{
  "schema_version": 1,
  "kind": "artifact-layout",
  "moves": {
    "docs/harness/features/1014446-autenticacao/.flow/create-payload.json": "docs/harness/features/1014446-autenticacao/.flow/publications/f747abc5-f548-5e05-8fb3-c2d7e3662735/create-payload.json",
    "docs/harness/features/1014446-autenticacao/.flow/publication-alignment.json": "docs/harness/features/1014446-autenticacao/.flow/publications/24e5c2eb-a369-5116-a74b-c8b92ffb664a/publication-alignment.json",
    "docs/harness/features/1014446-autenticacao/.flow/publication-preview.md": "docs/harness/features/1014446-autenticacao/.flow/publications/f747abc5-f548-5e05-8fb3-c2d7e3662735/publication-preview.md",
    "docs/harness/features/1014446-autenticacao/.flow/publish-payload.json": "docs/harness/features/1014446-autenticacao/.flow/publications/f747abc5-f548-5e05-8fb3-c2d7e3662735/publish-payload.json",
    "docs/harness/features/1014446-autenticacao/alignment-after.json": "docs/harness/features/1014446-autenticacao/.flow/publications/24e5c2eb-a369-5116-a74b-c8b92ffb664a/alignment-after.json",
    "docs/harness/features/1014446-autenticacao/alignment-before.json": "docs/harness/features/1014446-autenticacao/.flow/publications/24e5c2eb-a369-5116-a74b-c8b92ffb664a/alignment-before.json",
    "docs/harness/features/1014446-autenticacao/alignment-payload.json": "docs/harness/features/1014446-autenticacao/.flow/publications/24e5c2eb-a369-5116-a74b-c8b92ffb664a/alignment-payload.json",
    "docs/harness/features/1014446-autenticacao/alignment-preview.md": "docs/harness/features/1014446-autenticacao/.flow/publications/24e5c2eb-a369-5116-a74b-c8b92ffb664a/alignment-preview.md",
    "docs/harness/features/1014446-autenticacao/create-payload.json": "docs/harness/features/1014446-autenticacao/.flow/publications/f747abc5-f548-5e05-8fb3-c2d7e3662735/create-payload.json",
    "docs/harness/features/1014446-autenticacao/feature-state.json": "docs/harness/features/1014446-autenticacao/.flow/feature-state.json",
    "docs/harness/features/1014446-autenticacao/interview.md": "docs/harness/features/1014446-autenticacao/history/interview.md",
    "docs/harness/features/1014446-autenticacao/publication-alignment.json": "docs/harness/features/1014446-autenticacao/.flow/publications/24e5c2eb-a369-5116-a74b-c8b92ffb664a/publication-alignment.json",
    "docs/harness/features/1014446-autenticacao/publication-preview.md": "docs/harness/features/1014446-autenticacao/.flow/publications/f747abc5-f548-5e05-8fb3-c2d7e3662735/publication-preview.md",
    "docs/harness/features/1014446-autenticacao/publish-payload.json": "docs/harness/features/1014446-autenticacao/.flow/publications/f747abc5-f548-5e05-8fb3-c2d7e3662735/publish-payload.json",
    "docs/harness/features/1014447-recuperacao-de-senha/.flow/create-payload.json": "docs/harness/features/1014447-recuperacao-de-senha/.flow/publications/d210abed-97e7-5124-af27-56d9cfffeb8a/create-payload.json",
    "docs/harness/features/1014447-recuperacao-de-senha/.flow/publication-alignment.json": "docs/harness/features/1014447-recuperacao-de-senha/.flow/publications/185cad33-08ce-5919-84f3-e238791e0cea/publication-alignment.json",
    "docs/harness/features/1014447-recuperacao-de-senha/.flow/publication-preview.md": "docs/harness/features/1014447-recuperacao-de-senha/.flow/publications/d210abed-97e7-5124-af27-56d9cfffeb8a/publication-preview.md",
    "docs/harness/features/1014447-recuperacao-de-senha/.flow/publish-payload.json": "docs/harness/features/1014447-recuperacao-de-senha/.flow/publications/d210abed-97e7-5124-af27-56d9cfffeb8a/publish-payload.json",
    "docs/harness/features/1014447-recuperacao-de-senha/alignment-after.json": "docs/harness/features/1014447-recuperacao-de-senha/.flow/publications/185cad33-08ce-5919-84f3-e238791e0cea/alignment-after.json",
    "docs/harness/features/1014447-recuperacao-de-senha/alignment-before.json": "docs/harness/features/1014447-recuperacao-de-senha/.flow/publications/185cad33-08ce-5919-84f3-e238791e0cea/alignment-before.json",
    "docs/harness/features/1014447-recuperacao-de-senha/alignment-payload.json": "docs/harness/features/1014447-recuperacao-de-senha/.flow/publications/185cad33-08ce-5919-84f3-e238791e0cea/alignment-payload.json",
    "docs/harness/features/1014447-recuperacao-de-senha/alignment-preview.md": "docs/harness/features/1014447-recuperacao-de-senha/.flow/publications/185cad33-08ce-5919-84f3-e238791e0cea/alignment-preview.md",
    "docs/harness/features/1014447-recuperacao-de-senha/create-payload.json": "docs/harness/features/1014447-recuperacao-de-senha/.flow/publications/d210abed-97e7-5124-af27-56d9cfffeb8a/create-payload.json",
    "docs/harness/features/1014447-recuperacao-de-senha/feature-state.json": "docs/harness/features/1014447-recuperacao-de-senha/.flow/feature-state.json",
    "docs/harness/features/1014447-recuperacao-de-senha/interview.md": "docs/harness/features/1014447-recuperacao-de-senha/history/interview.md",
    "docs/harness/features/1014447-recuperacao-de-senha/publication-alignment.json": "docs/harness/features/1014447-recuperacao-de-senha/.flow/publications/185cad33-08ce-5919-84f3-e238791e0cea/publication-alignment.json",
    "docs/harness/features/1014447-recuperacao-de-senha/publication-preview.md": "docs/harness/features/1014447-recuperacao-de-senha/.flow/publications/d210abed-97e7-5124-af27-56d9cfffeb8a/publication-preview.md",
    "docs/harness/features/1014447-recuperacao-de-senha/publish-payload.json": "docs/harness/features/1014447-recuperacao-de-senha/.flow/publications/d210abed-97e7-5124-af27-56d9cfffeb8a/publish-payload.json",
    "docs/harness/features/1014448-meu-perfil/.flow/create-payload.json": "docs/harness/features/1014448-meu-perfil/.flow/publications/29abc5bf-ff69-5480-9010-188625d0aa63/create-payload.json",
    "docs/harness/features/1014448-meu-perfil/.flow/publication-alignment.json": "docs/harness/features/1014448-meu-perfil/.flow/publications/a27c9de1-4d30-506f-abc4-0bc345447dd5/publication-alignment.json",
    "docs/harness/features/1014448-meu-perfil/.flow/publication-preview.md": "docs/harness/features/1014448-meu-perfil/.flow/publications/29abc5bf-ff69-5480-9010-188625d0aa63/publication-preview.md",
    "docs/harness/features/1014448-meu-perfil/.flow/publish-payload.json": "docs/harness/features/1014448-meu-perfil/.flow/publications/29abc5bf-ff69-5480-9010-188625d0aa63/publish-payload.json",
    "docs/harness/features/1014448-meu-perfil/.flow/relation-preview.json": "docs/harness/features/1014448-meu-perfil/.flow/publications/29abc5bf-ff69-5480-9010-188625d0aa63/relation-preview.json",
    "docs/harness/features/1014448-meu-perfil/alignment-after.json": "docs/harness/features/1014448-meu-perfil/.flow/publications/a27c9de1-4d30-506f-abc4-0bc345447dd5/alignment-after.json",
    "docs/harness/features/1014448-meu-perfil/alignment-before.json": "docs/harness/features/1014448-meu-perfil/.flow/publications/a27c9de1-4d30-506f-abc4-0bc345447dd5/alignment-before.json",
    "docs/harness/features/1014448-meu-perfil/alignment-canonical-preview.md": "docs/harness/features/1014448-meu-perfil/.flow/publications/a27c9de1-4d30-506f-abc4-0bc345447dd5/alignment-canonical-preview.md",
    "docs/harness/features/1014448-meu-perfil/alignment-payload.json": "docs/harness/features/1014448-meu-perfil/.flow/publications/a27c9de1-4d30-506f-abc4-0bc345447dd5/alignment-payload.json",
    "docs/harness/features/1014448-meu-perfil/alignment-preview.md": "docs/harness/features/1014448-meu-perfil/.flow/publications/a27c9de1-4d30-506f-abc4-0bc345447dd5/alignment-preview.md",
    "docs/harness/features/1014448-meu-perfil/create-payload.json": "docs/harness/features/1014448-meu-perfil/.flow/publications/29abc5bf-ff69-5480-9010-188625d0aa63/create-payload.json",
    "docs/harness/features/1014448-meu-perfil/feature-state.json": "docs/harness/features/1014448-meu-perfil/.flow/feature-state.json",
    "docs/harness/features/1014448-meu-perfil/interview.md": "docs/harness/features/1014448-meu-perfil/history/interview.md",
    "docs/harness/features/1014448-meu-perfil/publication-alignment.json": "docs/harness/features/1014448-meu-perfil/.flow/publications/a27c9de1-4d30-506f-abc4-0bc345447dd5/publication-alignment.json",
    "docs/harness/features/1014448-meu-perfil/publication-preview.md": "docs/harness/features/1014448-meu-perfil/.flow/publications/29abc5bf-ff69-5480-9010-188625d0aa63/publication-preview.md",
    "docs/harness/features/1014448-meu-perfil/publish-payload.json": "docs/harness/features/1014448-meu-perfil/.flow/publications/29abc5bf-ff69-5480-9010-188625d0aa63/publish-payload.json",
    "docs/harness/features/1014448-meu-perfil/relation-operation.json": "docs/harness/features/1014448-meu-perfil/.flow/publications/29abc5bf-ff69-5480-9010-188625d0aa63/relation-operation.json",
    "docs/harness/features/1014448-meu-perfil/relation-preview.json": "docs/harness/features/1014448-meu-perfil/.flow/publications/29abc5bf-ff69-5480-9010-188625d0aa63/relation-preview.json",
    "docs/harness/features/1014449-gestao-de-usuario/.flow/create-payload.json": "docs/harness/features/1014449-gestao-de-usuario/.flow/publications/1d1ebcc2-3257-5b4f-8a3f-bc1521913772/create-payload.json",
    "docs/harness/features/1014449-gestao-de-usuario/.flow/publication-alignment.json": "docs/harness/features/1014449-gestao-de-usuario/.flow/publications/fd81b91c-3cbe-567d-a186-ff068bfad6aa/publication-alignment.json",
    "docs/harness/features/1014449-gestao-de-usuario/.flow/publication-preview.md": "docs/harness/features/1014449-gestao-de-usuario/.flow/publications/1d1ebcc2-3257-5b4f-8a3f-bc1521913772/publication-preview.md",
    "docs/harness/features/1014449-gestao-de-usuario/.flow/publish-payload.json": "docs/harness/features/1014449-gestao-de-usuario/.flow/publications/1d1ebcc2-3257-5b4f-8a3f-bc1521913772/publish-payload.json",